{
  "$schema": "./effects-schema.json",
  "version": 1,
  "atmosphereMix": 0.12,
  "selectedPulsePeriodMs": 2500,
  "primitives": {
    "off": 0,
    "solid": 1,
    "shallowBreath": 2,
    "breath": 3,
    "doublePulse": 4,
    "riseFade": 5,
    "pressFlash": 6
  },
  "semantics": {
    "unassigned": {
      "hex": "#000000",
      "hue": 0,
      "saturation": 0,
      "value": 0,
      "basePrimitive": "off",
      "selectedPrimitive": "off"
    },
    "idle": {
      "hex": "#FFFFFF",
      "hue": 0,
      "saturation": 0,
      "value": 255,
      "basePrimitive": "solid",
      "selectedPrimitive": "shallowBreath"
    },
    "working": {
      "hex": "#304FFE",
      "hue": 166,
      "saturation": 207,
      "value": 255,
      "basePrimitive": "solid",
      "selectedPrimitive": "shallowBreath"
    },
    "completeUnread": {
      "hex": "#00FF4C",
      "hue": 96,
      "saturation": 255,
      "value": 255,
      "basePrimitive": "solid",
      "selectedPrimitive": "breath",
      "entryPrimitive": "riseFade",
      "entryDurationMs": 600
    },
    "requiresInput": {
      "hex": "#FF6D00",
      "hue": 18,
      "saturation": 255,
      "value": 255,
      "basePrimitive": "solid",
      "selectedPrimitive": "breath",
      "entryPrimitive": "doublePulse",
      "entryDurationMs": 900
    },
    "error": {
      "hex": "#FF0033",
      "hue": 250,
      "saturation": 255,
      "value": 255,
      "basePrimitive": "solid",
      "selectedPrimitive": "breath",
      "entryPrimitive": "doublePulse",
      "entryDurationMs": 900
    },
    "offline": {
      "hex": "#000000",
      "hue": 0,
      "saturation": 0,
      "value": 0,
      "basePrimitive": "off",
      "selectedPrimitive": "off"
    }
  },
  "voice": {
    "recording": {
      "hex": "#20E0B2",
      "hue": 117,
      "saturation": 219,
      "value": 224,
      "primitive": "breath"
    },
    "processing": {
      "hex": "#FFFFFF",
      "hue": 0,
      "saturation": 0,
      "value": 255,
      "primitive": "breath"
    },
    "ready": {
      "hex": "#FFFFFF",
      "hue": 0,
      "saturation": 0,
      "value": 255,
      "primitive": "solid"
    }
  },
  "priority": [
    "keychronSystem",
    "bindingCaptureTransient",
    "ptt",
    "approvalInput",
    "taskSlot",
    "commandAvailability",
    "globalAtmosphere"
  ]
}
